[
  {
    "schema_version": 1,
    "event_id": "299b3b31-26f6-536c-9f63-f55f60c362ee",
    "campaign_id": "3d83526b-036c-505c-a18a-ef76ae88b6ec",
    "sequence": 1,
    "from_state": "CREATED",
    "to_state": "VALIDATING",
    "reason": "validate backend capability",
    "actor": "kcrash-controller",
    "occurred_utc": "2026-08-31T00:00:00+00:00",
    "virtual_elapsed_ms": 0,
    "correlation_id": "6d8f3dc4-707e-5352-a8c0-b9d19b1a5b8a"
  },
  {
    "schema_version": 1,
    "event_id": "145fd39a-8934-5415-8d80-40ce7529f290",
    "campaign_id": "3d83526b-036c-505c-a18a-ef76ae88b6ec",
    "sequence": 2,
    "from_state": "VALIDATING",
    "to_state": "ACQUIRING",
    "reason": "simulator capability contract accepted",
    "actor": "kcrash-controller",
    "occurred_utc": "2026-08-31T00:00:00+00:00",
    "virtual_elapsed_ms": 0,
    "correlation_id": "6d8f3dc4-707e-5352-a8c0-b9d19b1a5b8a"
  },
  {
    "schema_version": 1,
    "event_id": "2a558168-cd83-5754-8f95-fb50a1ea4d65",
    "campaign_id": "3d83526b-036c-505c-a18a-ef76ae88b6ec",
    "sequence": 3,
    "from_state": "ACQUIRING",
    "to_state": "READY",
    "reason": "deterministic simulated lease acquired",
    "actor": "kcrash-controller",
    "occurred_utc": "2026-08-31T00:00:00+00:00",
    "virtual_elapsed_ms": 0,
    "correlation_id": "6d8f3dc4-707e-5352-a8c0-b9d19b1a5b8a"
  },
  {
    "schema_version": 1,
    "event_id": "90cc9340-72ef-5336-bd44-e3d78b0ca0e0",
    "campaign_id": "3d83526b-036c-505c-a18a-ef76ae88b6ec",
    "sequence": 4,
    "from_state": "READY",
    "to_state": "DISPATCHING",
    "reason": "case dispatch prepared",
    "actor": "kcrash-controller",
    "occurred_utc": "2026-08-31T00:00:00+00:00",
    "virtual_elapsed_ms": 0,
    "correlation_id": "6d8f3dc4-707e-5352-a8c0-b9d19b1a5b8a"
  },
  {
    "schema_version": 1,
    "event_id": "82be36ed-a4b9-5d23-8ac9-6b66f49686a0",
    "campaign_id": "3d83526b-036c-505c-a18a-ef76ae88b6ec",
    "sequence": 5,
    "from_state": "DISPATCHING",
    "to_state": "RUNNING",
    "reason": "idempotent dispatch acknowledged",
    "actor": "kcrash-controller",
    "occurred_utc": "2026-08-31T00:00:00+00:00",
    "virtual_elapsed_ms": 0,
    "correlation_id": "6d8f3dc4-707e-5352-a8c0-b9d19b1a5b8a"
  },
  {
    "schema_version": 1,
    "event_id": "98f96baf-d338-5bb1-8f03-ccd1aeb8c3da",
    "campaign_id": "3d83526b-036c-505c-a18a-ef76ae88b6ec",
    "sequence": 6,
    "from_state": "RUNNING",
    "to_state": "SUSPECTED_FAILURE",
    "reason": "failure:synthetic-state-bounds;kind:FailureDetected",
    "actor": "kcrash-controller",
    "occurred_utc": "2026-08-31T00:00:00.06+00:00",
    "virtual_elapsed_ms": 60,
    "correlation_id": "6d8f3dc4-707e-5352-a8c0-b9d19b1a5b8a"
  },
  {
    "schema_version": 1,
    "event_id": "349c3355-e8c4-5b22-8e06-3bb6a4faa0b9",
    "campaign_id": "3d83526b-036c-505c-a18a-ef76ae88b6ec",
    "sequence": 7,
    "from_state": "SUSPECTED_FAILURE",
    "to_state": "COLLECTING",
    "reason": "synthetic artifact reported stable",
    "actor": "kcrash-controller",
    "occurred_utc": "2026-08-31T00:00:00.18+00:00",
    "virtual_elapsed_ms": 180,
    "correlation_id": "6d8f3dc4-707e-5352-a8c0-b9d19b1a5b8a"
  },
  {
    "schema_version": 1,
    "event_id": "29af4c69-a2c8-55df-acc8-e3fd84ad083d",
    "campaign_id": "3d83526b-036c-505c-a18a-ef76ae88b6ec",
    "sequence": 8,
    "from_state": "COLLECTING",
    "to_state": "TRIAGING",
    "reason": "synthetic artifact committed for fixture triage",
    "actor": "kcrash-controller",
    "occurred_utc": "2026-08-31T00:00:00.18+00:00",
    "virtual_elapsed_ms": 180,
    "correlation_id": "6d8f3dc4-707e-5352-a8c0-b9d19b1a5b8a"
  },
  {
    "schema_version": 1,
    "event_id": "adbf1299-48e0-5664-8a92-9c45e06e9bb9",
    "campaign_id": "3d83526b-036c-505c-a18a-ef76ae88b6ec",
    "sequence": 9,
    "from_state": "TRIAGING",
    "to_state": "COMPLETE",
    "reason": "synthetic signature computed; no kernel claim",
    "actor": "kcrash-controller",
    "occurred_utc": "2026-08-31T00:00:00.18+00:00",
    "virtual_elapsed_ms": 180,
    "correlation_id": "6d8f3dc4-707e-5352-a8c0-b9d19b1a5b8a"
  }
]